"id","title","authors","venue","year"
"conf/sigmod/VossenW99","The WASA2 Object-Oriented Workflow Management System","Mathias Weske, Gottfried Vossen","SIGMOD Conference",1999
"conf/sigmod/BouguettayaBH99","World Wide Database - Integrating the Web, CORBA, and Databases","Kevin Smith, Athman Bouguettaya, Mourad Ouzzani, James Beard, Lily Hendra, Boualem Benatallah","SIGMOD Conference",1999
"conf/sigmod/RoussopoulosKS99","The Active MultiSync Controller of the Cubetree Storage Organization","Yannis Sismanis, Yannis Kotidis, Nick Roussopoulos","SIGMOD Conference",1999
"journals/sigmod/BuchnerM98","Discovering Internet Marketing Intelligence through Online Analytical Web Usage Mining","Alex G. Büchner, Maurice D. Mulvenna","SIGMOD Record",1998
"journals/sigmod/DogacDATKCD98","A Workflow-based Electronic Marketplace on the Web","Ibrahim Cingil, Nazife Dimililer, Nesime Tatbul, Ilker Durusoy, Asuman Dogac, Pinar Koksal, Sena Nural Arpinar","SIGMOD Record",1998
"journals/sigmod/Mackay99","Semantic Integration of Environmental Models for Application to Global Information Systems and Decision-Making","D. Scott Mackay","SIGMOD Record",1999
